{
  "schema_version": "1.0",
  "protocol": "koni.rust-semantic-suite.v1",
  "oracle": {
    "tag": "rust-oracle-baseline",
    "commit": "fcc425e51114bcedb9aeae44d6e8c8418a525e6b",
    "tree": "2d96962668275f8e180f6d66cb574354ac0b0cda"
  },
  "isolation": {
    "detached_oracle_worktree": true,
    "temporary_home": true,
    "provider_calls": 0,
    "live_project_mutations": 0,
    "network": "fixture_only",
    "test_network": "loopback_only",
    "network_enforcement": "sandbox-exec deny network* with explicit localhost bind/inbound/outbound allowance",
    "sandbox_incompatible_exclusions": [
      "codex_permission_profile_writes_scratch_but_denies_project",
      "timeout_kills_the_complete_agent_process_group",
      "credential_socket_is_inherited_only_as_fd_three",
      "supervised_host_drains_stderr_without_blocking_and_caps_diagnostics",
      "unrelated_non_cloexec_descriptor_is_not_inherited",
      "agent_process_is_started_in_its_own_process_group",
      "bundled_software_direct_pi_broker_submits_and_compiles_once",
      "composed_broker_failure_boundaries_reconcile_without_duplicate_effects",
      "composed_execute_and_revoke_are_safe_in_both_lock_orderings",
      "composed_lead_execution_commits_every_enabled_action_path",
      "composed_lead_spawn_then_yield_keeps_the_same_grant_current",
      "configured_nonzero_exit_is_a_passing_durable_check_receipt",
      "configured_run_step_executes_and_writes_its_runtime_receipt",
      "direct_pi_worker_grant_pages_large_context_and_recovers_write_postimage_after_reopen",
      "gate_command_resolution_is_exactly_ticket_scoped",
      "macos_read_only_sandbox_allows_only_declared_reads_and_private_scratch",
      "zombie_process_is_not_reported_as_a_live_worker",
      "red_to_green_freezes_only_source_bytes_across_distinct_child_checks",
      "historical_baseline_aggregate_binds_output_recorded_before_receipt",
      "inverse_selected_members_are_stable_exact_and_fail_closed_on_topology_drift",
      "committed_relocation_request_without_transaction_quarantines_ordinary_authority",
      "planned_proof_source_relocation_is_journaled_exact_and_replay_safe",
      "tracked_backend_recovery_reconstructs_partial_action_success_before_h1",
      "tracked_backend_recovery_finalizes_existing_h2_without_advancing_integration",
      "tracked_backend_recovery_rejects_unrelated_request_checkpoint_change",
      "tracked_backend_recovery_rejects_action_success_missing_canonical_retry_binding",
      "tracked_backend_recovery_rejects_tree_excluded_blob_in_request_checkpoint",
      "tracked_backend_relocation_pins_action_checkpoint_then_seals_and_replays",
      "tracked_backend_relocation_recovers_every_durable_publication_phase",
      "compile_ticket_action_reaccepts_filesystem_changes_for_tracked_and_git_common_storage",
      "canonical_gate_edge_and_compatible_asset_relationship_advance_gate",
      "compiler_filesystem_manifest_scopes_acceptance_and_reopens_on_vendor_or_file_staleness",
      "automatic_gate_preflight_skips_gaps_and_honors_legacy_run_gate_owner",
      "automatic_gate_terminal_matrix_respects_scoped_impact_and_full_catchup",
      "composed_verification_rejects_nonpassing_receipts_even_when_the_check_allows_them",
      "failed_composed_verification_blocks_and_retry_rebinds_the_fixed_run_tree",
      "git_common_verification_binds_promotion_to_the_exact_checked_head",
      "intervening_run_commit_after_target_sync_reopens_sync_before_verification",
      "promotion_requires_one_safe_receipt_projection_for_each_bound_check",
      "running_read_only_command_and_deletion_serialize_at_durable_boundaries",
      "target_bound_run_waits_for_authorization_then_promotes_the_verified_head",
      "target_only_commit_after_target_sync_reopens_before_verification",
      "target_sync_cas_input_move_returns_to_pending_and_rebinds",
      "tracked_report_after_verification_preserves_the_exact_product_projection",
      "unchecked_product_changes_after_verification_never_become_promotion_ready",
      "software_assurance_scales_and_risk_treatment_has_disjoint_routing",
      "software_bug_fix_bootstraps_prepares_diagnoses_then_plans_the_causal_change",
      "software_bug_fix_planning_exact_covers_every_active_diagnosed_defect",
      "software_bug_fix_requires_causal_diagnosis_and_an_addressing_change",
      "software_delivery_requires_current_proof_and_exact_nonvacuous_coverage",
      "software_each_proof_strategy_runs_baseline_product_promotion_review_and_finish",
      "software_failed_implementation_proof_preparation_blocks_product_authority",
      "software_git_common_preparation_integrates_at_its_exact_ticket_materialization_boundary",
      "software_implementation_review_stamps_only_its_pinned_active_proofs",
      "software_migration_preparation_gate_routes_authoring_strategies_only",
      "software_one_change_accepts_multiple_nonredundant_focused_proofs_in_one_ticket",
      "software_preparation_current_rejects_effect_destination_and_historical_receipt_drift",
      "software_prepared_risk_boundary_waits_for_introducer_and_control_then_runs_green",
      "software_review_rework_keeps_prepared_oracle_immutable_and_reopens_product_only",
      "software_sibling_proof_tickets_select_and_stamp_exactly_one_shared_subject_member",
      "software_stale_candidate_delivery_revises_the_same_exact_scoped_node",
      "software_upstream_oracle_review_failure_holds_change_migration_and_multi_proof_candidates"
    ]
  },
  "build_command": [
    "cargo",
    "test",
    "--workspace",
    "--no-run"
  ],
  "command": [
    "cargo",
    "test",
    "--workspace",
    "--",
    "--format",
    "pretty",
    "--skip",
    "codex_permission_profile_writes_scratch_but_denies_project",
    "--skip",
    "timeout_kills_the_complete_agent_process_group",
    "--skip",
    "credential_socket_is_inherited_only_as_fd_three",
    "--skip",
    "supervised_host_drains_stderr_without_blocking_and_caps_diagnostics",
    "--skip",
    "unrelated_non_cloexec_descriptor_is_not_inherited",
    "--skip",
    "agent_process_is_started_in_its_own_process_group",
    "--skip",
    "bundled_software_direct_pi_broker_submits_and_compiles_once",
    "--skip",
    "composed_broker_failure_boundaries_reconcile_without_duplicate_effects",
    "--skip",
    "composed_execute_and_revoke_are_safe_in_both_lock_orderings",
    "--skip",
    "composed_lead_execution_commits_every_enabled_action_path",
    "--skip",
    "composed_lead_spawn_then_yield_keeps_the_same_grant_current",
    "--skip",
    "configured_nonzero_exit_is_a_passing_durable_check_receipt",
    "--skip",
    "configured_run_step_executes_and_writes_its_runtime_receipt",
    "--skip",
    "direct_pi_worker_grant_pages_large_context_and_recovers_write_postimage_after_reopen",
    "--skip",
    "gate_command_resolution_is_exactly_ticket_scoped",
    "--skip",
    "macos_read_only_sandbox_allows_only_declared_reads_and_private_scratch",
    "--skip",
    "zombie_process_is_not_reported_as_a_live_worker",
    "--skip",
    "red_to_green_freezes_only_source_bytes_across_distinct_child_checks",
    "--skip",
    "historical_baseline_aggregate_binds_output_recorded_before_receipt",
    "--skip",
    "inverse_selected_members_are_stable_exact_and_fail_closed_on_topology_drift",
    "--skip",
    "committed_relocation_request_without_transaction_quarantines_ordinary_authority",
    "--skip",
    "planned_proof_source_relocation_is_journaled_exact_and_replay_safe",
    "--skip",
    "tracked_backend_recovery_reconstructs_partial_action_success_before_h1",
    "--skip",
    "tracked_backend_recovery_finalizes_existing_h2_without_advancing_integration",
    "--skip",
    "tracked_backend_recovery_rejects_unrelated_request_checkpoint_change",
    "--skip",
    "tracked_backend_recovery_rejects_action_success_missing_canonical_retry_binding",
    "--skip",
    "tracked_backend_recovery_rejects_tree_excluded_blob_in_request_checkpoint",
    "--skip",
    "tracked_backend_relocation_pins_action_checkpoint_then_seals_and_replays",
    "--skip",
    "tracked_backend_relocation_recovers_every_durable_publication_phase",
    "--skip",
    "compile_ticket_action_reaccepts_filesystem_changes_for_tracked_and_git_common_storage",
    "--skip",
    "canonical_gate_edge_and_compatible_asset_relationship_advance_gate",
    "--skip",
    "compiler_filesystem_manifest_scopes_acceptance_and_reopens_on_vendor_or_file_staleness",
    "--skip",
    "automatic_gate_preflight_skips_gaps_and_honors_legacy_run_gate_owner",
    "--skip",
    "automatic_gate_terminal_matrix_respects_scoped_impact_and_full_catchup",
    "--skip",
    "composed_verification_rejects_nonpassing_receipts_even_when_the_check_allows_them",
    "--skip",
    "failed_composed_verification_blocks_and_retry_rebinds_the_fixed_run_tree",
    "--skip",
    "git_common_verification_binds_promotion_to_the_exact_checked_head",
    "--skip",
    "intervening_run_commit_after_target_sync_reopens_sync_before_verification",
    "--skip",
    "promotion_requires_one_safe_receipt_projection_for_each_bound_check",
    "--skip",
    "running_read_only_command_and_deletion_serialize_at_durable_boundaries",
    "--skip",
    "target_bound_run_waits_for_authorization_then_promotes_the_verified_head",
    "--skip",
    "target_only_commit_after_target_sync_reopens_before_verification",
    "--skip",
    "target_sync_cas_input_move_returns_to_pending_and_rebinds",
    "--skip",
    "tracked_report_after_verification_preserves_the_exact_product_projection",
    "--skip",
    "unchecked_product_changes_after_verification_never_become_promotion_ready",
    "--skip",
    "software_assurance_scales_and_risk_treatment_has_disjoint_routing",
    "--skip",
    "software_bug_fix_bootstraps_prepares_diagnoses_then_plans_the_causal_change",
    "--skip",
    "software_bug_fix_planning_exact_covers_every_active_diagnosed_defect",
    "--skip",